### ISSUE TITLE
Connection Timed out via Proxy

### ISSUE THREAD

**Issue by denizciftci-sec** [Velocidex/velociraptor#2954]
Hi Team!
Have strange problem related proxy/network connection.
First of all, ENV variables are in place for PROXY and able to connect any public resource via CLI.

When I selected specific artifacts that require internet access - it fails due to internet connection problem.
Could you please assist me regarding this topic? 

For example: I select>  Server.Utils.CreateMSI

Logs: 
inventory_get: Get "https://github.com/Velocidex/velociraptor/releases/download/v0.6.9/velociraptor-v0.6.9-windows-amd64.msi": dial tcp 140.82.121.3:443: connect: connection timed out

Tcpdump:

13:47:49.204545 IP 10.171.24.231.37586 > 140.82.121.3.443: Flags [S], seq 2805509819, win 64240, options [mss 1460,sackOK,TS val 3822113480 ecr 0,nop,wscale 7], length 0
13:47:53.460566 IP 10.171.24.231.37586 > 140.82.121.3.443: Flags [S], seq 2805509819, win 64240, options [mss 1460,sackOK,TS val 3822117736 ecr 0,nop,wscale 7], length 0
13:48:01.652540 IP 10.171.24.231.37586 > 140.82.121.3.443: Flags [S], seq 2805509819, win 64240, options [mss 1460,sackOK,TS val 3822125928 ecr 0,nop,wscale 7], length 0
13:48:17.780555 IP 10.171.24.231.37586 > 140.82.121.3.443: Flags [S], seq 2805509819, win 64240, options [mss 1460,sackOK,TS val 3822142056 ecr 0,nop,wscale 7], length

Proxy ENV variables:
https_proxy=http://BC-PROXY....
HTTPS_PROXY=http://BC-PROXY...
HTTP_PROXY=http://BC-PROXY-VIP...
http_proxy=http://BC-PROXY-VIP...

Internet Connection Test:
root@dewsttlsc10:/opt/velociraptor# wget google.com
--2023-09-18 13:51:14--  http://google.com/
Resolving bc-proxy 
Connecting to XXX . connected.
Proxy request sent, awaiting response... 301 Moved Permanently
Location: http://www.google.com/ [following]
--2023-09-18 13:51:14--  http://www.google.com/
Reusing existing connection to XXXX
Proxy request sent, awaiting response... 200 OK
Length: unspecified [text/html]
Saving to: ‘index.html’

**index.html                                                      [ <=>                                                                                                                                     ]  17.44K  --.-KB/s    in 0s**

**2023-09-18 13:51:14 (160 MB/s) - ‘index.html’ saved [17856]**

**Comment by scudette** [comment]
You need to set the proxy in the config file

https://docs.velociraptor.app/docs/deployment/references/#Client.proxy

**Comment by denizciftci-sec** [comment]
Thanks, it worked!
